track_title,valence,lyrics,album_yr
Lost ,0.479,"i’m still standing here with my eyes closed
lost between the deserts and oceans
i’m still wandering
where should i go yeah
i didn’t know there were this many
paths i can’t go and paths i can’t take
i never felt this way before
am i becoming an adult?

this is too hard, is this path right for me
i am confused
never leave me alone
i still believe even though it’s unbelievable
to lose your path
is the way to find that path

lost my way
constantly pushing without rest
within the harsh rainstorms
lost my way
within a complicated world without an exit
lost my way
lost my way
no matter how much i wander
i want to believe in my path

lost my way
found my way
lost my way
found my way

i once saw an ant going somewhere
there is no way to find the path at once
constantly crashing and crawling forward
to find something to eat
roaming for days

you know
there is a reason for all this frustration
i believe that we’re on the right path
if we ever find it
we will return home at once
just like an ant

this is too hard, is this path right for me
i am so confused
don’t you leave me alone
i still want to believe even though it’s unbelievable
to lose your path
is the way to find that path

lost my way
constantly pushing without rest
within the harsh rainstorms
lost my way
within a complicated world without an exit
lost my way
lost my way
i wander
i want to believe in my path

so long
goodbye to my hope with no promise
so long
even if i’m slow i will walk with my own feet
because i know this path is mine to take
even if i go back, i will reach this path eventually
i never i will never
i will never lose my dream

lost my way
constantly pushing without rest
within the harsh rainstorms
lost my way
within a complicated world without an exit
lost my way
lost my way
i wander
i want to believe in my path

lost my way
found my way
lost my way
found my way",2016
BTS Cypher 4,0.362,"“name, name!” sorry bae
“pronunciation, pronunciation!” sorry bae
“diction, diction, diction!” sorry bae
“oh, face not an idol..” sorry bae

because i’m breathing i’m sorry bae
because i’m too healthy i’m sorry bae
i’m on the air i’m sorry bae
errthing errthing errthing
sorry bae
the sound that i’m making now bae
to someone else, it’s like a dog’s bark bae
why don’t you change your pattern
of talking shit about others bae
it’s about to get boring, boring bae
i’m not hateful of you anymore
i’m not hateful of you anymore sorry bae
i’ll be the drum, just hit me hard
let’s just try it, samulnori, bae
i’m a monster, my tail is too long, bae
you’ll shoot me anyway, bae
in that case, a zoo would be more comfortable, bae
you want it too, something to chew on, bae
you hate me but you know me
you hate me but you know me
i like hate comments more than no comments
i don’t know you
but you know my name

i love i love i love myself
i love i love i love myself
i know i know i know myself
ya playa haters you should love yourself
brr

i wanna get sleep time
without a chance to rest, we’re receiving spotlight
ahh you wanna be my life
those who are starving, just be my human shield
contacted softly and got spammed on my accord
haul to the stage all innocent okay
but i can’t be satisfied just being here
i’m climbing up there, high high high
that’s right, my method is different
i take on the road no matter what
sewing stich by stich
if you’re not able, put an end to it
there is no possibility
of pronouncing “failure”
i love ma rule, the work that i do with my bros
players in a league of their own
i’ll become the supervisor above them
so come what may
following 1verse, i’ll draw a bigger picture
for the rest of your life
continue screaming from that position
dream come true
honor and wealth isn’t that you
everyone chu on my foot sole after all
click, i’m cat, everyone’s mouse
i choose and put an x like kaws
i move in next year ma house
and high five with my brick
open your eyes and look at my ambition
lean in your ears and listen
this will be the first and final words

i love i love i love myself
i love i love i love myself
i know i know i know myself
ya playa haters you should love yourself
brr

back back to the basic
microphone check
call me a crow tit or badass
yes in this rap game
i’m the generous one
to rehabilitate the rap man who began to slack
is my first plan hashtag
sucka betta run gang gang in insta
that’s their life
my life is just day by day
payday, paycheck, rolex on my wrist
click clack to the bang hang
click clack to the pow
i’m so high how dare you covet
even if you run up to it, it’s too high for you to reach
the difference is pretty big, you can’t see it
after shattering your delusions
about your shitty cars
and once everyone’s done toying with them

so fly above your face that became a corpse
click clack to the bang, you and you
i’m always thankful, for not earning anything so easily
why is it my fault, that your life is noncommittal
keep on living like that vaguely
sorry but continue to look
because i’m gonna earn more from now
by all means please live healthily

i love i love i love myself
i love i love i love myself
i know i know i know myself
ya playa haters you should love yourself
brr

i love i love i love myself
i love i love i love myself
i know i know i know myself
ya playa haters you should love yourself
brr",2016
Am I Wrong ,0.68,"am i wrong, fallin' in love with you
tell me am i wrong
while your other man was out there
cheatin' and lyin', steppin' all over you

the world’s goin’ crazy
how about you how bout ya
you think it is okay
i don’t think it’s that okay
have ears but don’t listen
have eyes but don’t see
fish live in all our hearts
its name is selfish, selfish
we’re all dogs, pigs, become dogs because we’re angry
stork vs crow-tit warring errday
crazy world yeah
makes us crazy yeah
that’s right we’re all crazy
all right now give a shout
mayday mayday

it seems like the entire world has gone crazy
seems like the end
oh why oh why
oh why oh why
oh why why why why
oh my god

am i wrong
did i say something wrong?
did i lie?
going crazy (gone crazy gone crazy)
crazy (gone crazy gone crazy)
am i wrong
am i wrong
where am i going
the world’s going crazy

are you ready for this
are you ready for this
are you ready for this
no, i'm not

that’s right kid you gone crazy
the fact that you’re not crazy in a crazy world is crazy
the earth and sky and all around (hell yeah)
online offline (hell yeah)

if what you see on the news is nothing to you
if that comment is nothing to you
if that hatred is nothing to you
you’re not normal, you’re abnormal

it seems like the entire world has gone crazy
seems like the end
oh why oh why
oh why oh why
oh why why why why
oh my god

am i wrong
did i say something wrong?
am i wrong
did i lie?
going crazy (gone crazy gone crazy)
crazy (gone crazy gone crazy)
am i wrong (am i wrong)
am i wrong (am i wrong)
where am i going
the world’s going crazy
though i walk this crazy world’s path
i still want to live longer
i want to find it, my faith

am i wrong
did i say something wrong?
did i lie?
going crazy (gone crazy gone crazy)
crazy (gone crazy gone crazy)
am i wrong
am i wrong
where am i going
the world’s going crazy

are you ready for this
are you ready for this
are you ready for this",2016
21세기 소녀 (21st Century Girl),0.762,"you worth it you perfect
deserve it just work it
you look elegant, elegant
also you’re pretty, pretty
you shine, shine
you’re the truth and the reason

if anyone keeps insulting you, insulting you
tell em you’re my lady
go tell them, tell them
whatever other people say
whatever this world tells you
you’re the best to me just the way you are

don’t ever be scared
whatever people say, you’re okay alright
you are strong
you say yes or no yes or no

to the 20th century girls
live your life
live your life come on baby
to the 21st century girls
you don’t mind
you don’t mind that new lady

tell them that you’re strong
tell them you’re enough
let you go let you go let you go
let it go oh

all my ladies put your hands up
21st century girl
hands up
all my ladies put your hands up
now scream

you pass by, the guys say
oh yeah what is she, who is she
they go out of their mind, the girls say
oh what is he, who is he

oh bae don’t lower yourself
okay don’t set yourself to them
you’re mine
you’re beautiful enough
don’t worry don’t worry
baby you’re beautiful
you you you

to the 20th century girls
live your life
live your life come on baby
to the 21st century girls
you don’t mind
you don’t mind that new lady

tell them you’re strong
tell them you’re enough
let you go let you go let you go
let it go oh

all my ladies put your hands up
21st century girl
hands up
all my ladies put your hands up
now scream

everybody wanna love you
everybody gonna love you
don’t worry about anything else

everybody wanna love you bae
everybody gonna love you bae
you deserve to be loved

all my ladies put your hands up
21st century girl
hands up
all my ladies put your hands up
now scream

all my ladies put your hands up
21st century girl
hands up
all my ladies put your hands up
now scream",2016
둘! 셋! (그래도 좋은 날이 더 많기를) [2! 3! (Still Wishing For More Good Days)],0.599,"been trying to tell you this
i was supposed to tell you this
this is all for you

let’s only walk on flower trails
i can’t say that
let’s only see good things
i can’t say that either
saying that there will only be good things from now on
saying that you won’t get hurt
i can’t say that
i can’t lie like that

""because you’re all idols
it sucks even if i don’t hear it
i don’t like your lyrics
i can already imagine the performance
because you don’t have power, you would certainly
have done dirty deeds in the past
observing how you act
soon you’ll cease to exist.""
(thank you so much)
because of your inferiority complex
i was able to prove myself something
i wasn’t able to do when in high school
hands clapping, yes, keep on going, keep on going
we’ll be happy by ourselves
good, yeah, i’m good

it’s okay come on when i say one two three forget it
erase all sad memories hold my hand and smile

it’s okay, come on when i say one, two, three forget it
erase all sad memories
smile holding onto each other’s hands

hoping for more good days
if you believe what i say then one, two, three (one two three)
if you believe then one, two, three (one two three)

hoping for more good days
if you believe me then one, two, three(one two three)
if you believe then one, two, three (one two three)
hoping that everything will change when we say

1, 2, 3
hoping that everything will change
for a better day
because we are together

me, a shadow behind the stage
me, in the depth of darkness
i didn’t want to show everything, including my pain
but because i’m still unaccustomed
i just wanted to make you smile
i wanted to do good
so thanks
for believing in someone like me
for dealing with these tears and wounds
so thanks
for becoming my light
for becoming the flower in the most beautiful moment in life

it’s okay, come on when i say one, two, three forget it
erase all sad memories, hold my hand and smile

it’s okay, come on when i say one, two, three forget it
erase all sad memories
smile holding onto each other’s hands

hoping for more good days
if you believe what i say then one, two, three
if you believe then one, two, three

hoping for more good days
if you believe what i say then one, two, three
if you believe then one, two, three

if you believe then 1, 2, 3
if you believe then 1, 2, 3
if you believe then 1, 2, 3
if you believe then 2, 3 say

it’s okay, come on when i say one, two, threeforget it
erase all sad memories, hold my hand and smile
it’s okay, come on when i say one, two, three forget it
erase all sad memories
smile holding onto each other’s hands
hoping for more good days
if you believe what i say then one, two, three
if you believe then one, two, three
hoping for more good days
if you believe what i say then one, two, three
if you believe then one, two, three
it’s okay, come on when i say one, two, three forget it
erase all sad memories hold my hand and smile
it’s okay, come on when i say one, two, three forget it
erase all sad memories
smile holding onto each other’s hands
it’s okay, come on when i say one, two, three forget it
erase all sad memories
smile holding onto each other’s hands",2016
봄날 (Spring Day) ,0.46,"miss you
saying this makes me miss you even more
miss you
even though i’m looking at your photo
time’s so cruel, i hate us
seeing each other for once is now so hard between us

it’s all winter here, even in august
my heart is running on the time
alone on the snowpiercer
wanna get to the other side of the earth, holding your hand
wanna put an end to this winter
how much longing should we see snowing down
to have the days of spring, friend

like the tiny dust, tiny dust floating in the air
will i get to you a little faster
if i was the snow in the air

snowflakes fall down
and get farther away little by little
i miss you (i miss you)
i miss you (i miss you)
how long do i have to wait
and how many sleepless nights do i have to spend
to see you (to see you)
to meet you (to meet you)

passing by the edge of the cold winter
until the days of spring
until the days of flower blossoms
please stay, please stay there a little longer

is it you who changed (is it you who changed)
or is it me (or is it me)
i hate this moment, this time flowing by
we are changed you know
just like everyone you know

yes i hate you, you left me
but i never stopped thinking about you, not even a day
honestly i miss you, but i’ll erase you
'cause it hurts less than to blame you

i try to exhale you in pain
like smoke, like white smoke
i say that i’ll erase you
but i can’t really let you go yet

snowflakes fall down
and get farther away little by little
i miss you (i miss you)
i miss you (i miss you)
how long do i have to wait
and how many sleepless nights do i have to spend
to see you (to see you)
to meet you (to meet you)

you know it all
you’re my best friend
the morning will come again
no darkness, no season is eternal

maybe it’s cherry blossoms
and this winter will be over
i miss you (i miss you)
i miss you (i miss you)
wait a little bit, just a few more nights
i’ll be there to see you (i'll go there to meet you)
i’ll come for you (i'll come for you)

passing by the edge of the cold winter
until the days of spring
until the days of flower blossoms
please stay, please stay there a little longer",2017
Not Today ,0.665,"all the underdogs in the world
a day may come when we lose
but it is not today
today we fight

no, not today
flowers wither eventually
but no, not today
today is not that day
no no, not today
not yet a day to die
too good day
no no, not today
no no no, not today

yeah we are extra
but still part of this world
extra + ordinary
that’s nothing at all
we won’t ever die today
light shines through the darkness
it wants a new world and you
oh baby yes i want it

if you can’t fly, then run
today we will survive
if you can’t run, then walk
today we will survive
if you can’t walk, then crawl
even if you have to crawl, gear up
aim your gun! ready! fire!

not not today! not not today!
hey crow-tits everyone hands up
hey friends everyone hands up
hey if you believe me hands up
gun! ready! fire!

don’t die, don’t ask, scream
not not today
don’t kneel, don’t cry, raise your hands
not not today
hey not not today
hey not not today
hey not not today
gun! ready! fire!

too hot, success is doublin’
too hot tumbling in the charts
too high we on trampoline
too high someone stop us

we couldn’t fail
because we believed in each other
what you say yeah
not today yeah
we will never die today yeah

i believe in you by my side
together we won’t die
i believe in you by my side
together we won’t die
i believe in the word together
i believe in bts
aim your gun! ready! fire!

not not today! not not today!
hey crow-tits everyone hands up
hey friends everyone hands up
hey if you believe me hands up
gun! ready! fire!

don’t die, don’t ask, scream
not not today
don’t kneel, don’t cry, raise your hands
not not today
hey not not today
hey not not today
hey not not today
gun! ready! fire!

throw it up! throw it up!
forget about the fear in your eyes
break it up! break it up!
break the glass ceiling that cages you
turn it up! (turn it up!)
burn it up! (burn it up!)
until the day of victory (fight!)
don’t kneel, don’t collapse
that’s (do) not today!

not not today! not not today!
hey crow-tits everyone hands up
hey friends everyone hands up
hey if you believe me hands up
gun! ready! fire!

don’t die, don’t ask, scream
not not today
don’t kneel, don’t cry, raise your hands
not not today
hey not not today
hey not not today
hey not not today
gun! ready! aim!",2017
Outro: Wings ,0.659,"take me to the sky
put your hands up to the sky
yeah, if you feelin’ the vibe
uh, if you’re ready to fly
yo j, let’s do it

i remember my childhood
because i had no big worries
i knew these small feathers would become wings
i knew the wings would make me fly
i had that faith
along with laughter

(like a bird)
i went on the road that i was told not to go
i did things i was told not to do
i wanted things i couldn’t want
i got hurt and hurt again
you can call me stupid
then i’ll just smile
i don’t wanna succeed
by doing things i don’t wanna do
i’m pushing myself
word

i believe in myself
my back hurting is for my wings to come out
i believe in you, even if things are bleak right now
the end will be great
fly, fly up in the sky
fly, fly get ’em up high
it’s the path you chose, dude don’t be scared
this is just the first flight

take me to the sky
if i can fly
if i can run away forever
if my wings could fly
piercing through the air that’s getting heavier
flying, flying
higher than higher than
higher than the sky
flying, flying
with my reddened wings

spread spread spread my wings
la la la la la la, la la la la la la
spread spread spread my wings
la la la la la la, la la la la la la
wings are made to fly fly fly
fly fly fly
if my wings could fly

now i know
i’m breaking up with regretting with age
i made a decision
i will have unconditional trust
it’s time to be brave
i’m not afraid
because i believe
because i’m different from before
i won’t cry on my path
i won’t hang my head low
that is the sky
and i’ll be flying there, fly

spread spread spread my wings
la la la la la la, la la la la la la
spread spread spread my wings
la la la la la la, la la la la la la
wings are made to fly fly fly
fly fly fly
if my wings could fly",2017
A Supplementary Story: You Never Walk Alone ,0.59,"hey, why does god always
make us feel lonely
oh no no no no no no
yeah, even if we're covered in scars
we can smile if we’re together
at the end of this road you walk alone
will you step on it, whatever there may be
sometimes we may get tired or sick
that’s okay, i am by your side
if you and i are together
we can smile

i want to fly though i have no wings
but your hands become my wings
i want to forget the dark and lonely things
together with you
these wings sprouted from my pain
but these wings are going towards the light
even if it's tiring and painful, i will fly if i can
will you hold my hand
so that i won’t be afraid anymore?
if you and i are together
i can smile

this is the path i chose
and even if they say it's fate
because i created all of this
even if they say it's the price
i must pay for this life
will you walk with me?
will you fly with me?
to the edge of the sky
so i can touch your hand
even if it hurts like this
if you and i are together
i can smile

ayy i never walk alone
i can feel the warmth in your hand that i’m holding
ayy you never walk alone
feel me, you're not alone either
come on crawl, crawl,crawl
crawl it, like it like that
baby walk, walk, walk
walk it, like it like that
baby run, run, run
run it, like it like that
baby fly, fly, fly
fly it, like it like that
this road may be long and rough but
will you stay with me?
we may fall and sometimes get hurt but
will you stay with me?
ayy i never walk alone
if you and i are together, we can smile
ayy you never walk alone
if you and i are together, we can smile
if you and i are together, we can smile",2017
DNA ,0.687,"at first sight, i could recognize you
as if we were calling for each other
the dna in my blood vessels tell me
that it’s you i was looking all over for

our meeting is like a mathematical formula
commandments of religion, providence of the universe;
the evidence of destiny given to me
you’re the source of my dream
take it, take it
my hand reaching out to you is my chosen fate

don’t worry, love
none of this is a coincidence
we’re totally different, baby
because we’re the two who found our destiny

from the day of the universe’s creation and beyond
through the infinite centuries and beyond
in the previous life and maybe the next too
we’re eternally together

none of this is a coincidence
because we’re the two who found our destiny
dna

i want it this love i want it real love
i only focus on you
you steer me a little harder
the dna of the genesis wants you
this is inevitable, i love us
we are the only true lovers

every time i see her, i freak out
surprisingly, i keep gasping and it’s weird, maybe
this is the emotion they call love
because from the very beginning, my heart runs to you

don’t worry, love
none of this is a coincidence
we’re totally different, baby
because we’re the two who found our destiny

from the day of the universe’s creation and beyond
through the infinite centuries and beyond
in the previous life and maybe the next too
we’re eternally together

none of this is a coincidence
because we’re the two who found our destiny
dna

don’t look back
because we're the two who found our destiny
don’t regret it, baby
because we're forever
forever
forever
forever
forever
we are together

don’t worry, love
none of this is a coincidence
we’re totally different, baby
because we’re the two who found our destiny

la la la la la
la la la la la
because it’s not a coincidence
la la la la la
la la la la la
because it’s not a coincidence
dna",2017
Best of Me ,0.473,"when you say that you love me
i walk above the clouds
tell me about eternity just one more time
when you say that you love me
all i need is that one phrase
that you’ll never change, just one more time

you're like the whole world to me
hug me harder and more painfully
that something that we shared
and you can’t make it nothing
i hope you don’t forget
that you’re my

day by day
summer, winter
even if you don’t know

you got the best of me
you got the best of me
so please just don’t leave me
you got the best of me

even though i haven't seen my limits
but if it exists, it's probably you
i wanted to be the tender waves
but why didn’t i know you were the sea?
what do i do?
i speak with your language
and i breathe in your air
i’ll be you, i'll be in your grasp
as i kiss your sword

so take my hand right now
i don't believe that i'm like this
the words i've said to myself a million times
please, don’t leave me
you got the best of me
you got the best of me
it's not important if it's a dream or reality
only the fact that you're by my side
thanks

day by day
summer, winter
even if you may be unaware

you got the best of me
you got the best of me
so please just don’t leave me
you got the best of me

you’re my savior, you’re my window
all i need is you
you got the best of me
i need you
so please just don’t leave me
you got the best of me

i used to rain
i used to snow
i stop all the misfortune
and i bring the heavens
don't speak of it so lightly
there's no me without you
you’re the best of me
the best of me

you just give me the confidence within myself
that's all i wanted
there may not be rules between us
but the way to love exists
who got the best of me?
who got the best of me?
no one knows but i know me
you are my best master

you got the best of me
you got the best of me
so please just don’t leave me
you got the best of me

you’re my savior, you’re my window
all i need is you
you got the best of me
i need you
so please just don’t leave me
you got the best of me

when you say that you love me
i walk above the clouds
tell me of eternity, just one more time
when you say that you love me
all i need is that one phrase
that you’ll never change, just one more time",2017
