track_title,valence,lyrics,album_yr
I'm Fine ,0.302,"open your eyes under the cold blue sky
the pouring sun makes me dizzy
my breath is quickening, my heart is racing
i can feel it so easily that i’m alive

it’s alright, even if it’s not us
even if sadness erases me
even if there are clouds
even if i’m in an endless dream
even if i’m endlessly crumpled
even if my wings are torn
even if some day, i’m not me anymore
it’s alright, only i am my own salvation
i won’t ever die in this walk
how you doin? im fine
my sky is clear
all pain, say goodbye
goodbye

my cold heart
has forgotten how to call you
but i’m not lonely, i’m fine, i’m fine
the darkness of the night
shakes awake my sleeping dreams
but i’m not afraid, i’m fine, i’m fine

i'm feeling just fine, fine, fine
i'll let go of your hand now
i know i'm all mine, mine, mine
cuz i'm just fine
i'm feeling just fine, fine, fine
i don't want to be sad anymore
i could see the sunshine, shine, shine
cuz i'm just fine, just fine

(hey, hope world)
i’m just fine, all of my pain
i can overcome without you
i’m just fine, don’t worry
i can smile now
because everyone knows your voice

i’m so fine, you so fine
all of the sadness and scars
became an old memory now
so let’s smile and let go, we so fine
i’m so fine, you so fine
our future will only have happiness
so put away your fear
enjoy it, you worked hard, we so fine

my cold heart
has forgotten how to call you
but i’m not lonely, i’m fine, i’m fine
the darkness of the night
shakes awake my sleeping dreams
but i’m not afraid, i’m fine, i’m fine

i'm feeling just fine, fine, fine
i'll let go of your hand now
i know i'm all mine, mine, mine
cuz i'm just fine
i'm feeling just fine, fine, fine
i don't want to be sad anymore
i could see the sunshine, shine, shine
cuz i'm just fine, just fine

can you see it too?
the dim moonlight?
can you hear it too?
that faint echo?

i'm feeling just fine, fine, fine
i'll yell it out myself
casting a spell
on this repeating nightmare
i’m feeling just fine, fine, fine
i’ll keep telling myself
even if i fall down again
i’m fine

i'm feeling just fine, fine, fine
i'll yell it out myself
casting a spell
on this repeating nightmare
i’m feeling just fine, fine, fine
i’ll keep telling myself
even if i fall down again
i'm fine
i'm fine",2018
IDOL ,0.422,"you can call me artist (artist)
you can call me idol (idol)
no matter what you call me
i don’t care
i’m proud of it (proud it)
i’m free (free)
no more irony (irony)
cuz i was always just me

they point fingers at me
but i don’t care at all
whatever the reason for your criticism is
i know what i am (i know what i am)
i know what i want (i know what i want)
i never gon’ change (i never gon' change)
i never gon’ trade
(trade off)

keep on chit-chatting, saying this and that
i do what i do, so you do you
you can’t stop me lovin’ myself

eolssu, i like it
you can’t stop me lovin’ myself
i like the shouts
you can’t stop me lovin’ myself

oh-oh-owoah
oh-oh-owoah-owoah
oh-oh-owoah
dunkiduk kungduruhruh
ulssu
oh-oh-owoah
oh-oh-owoah-owoah
oh-oh-owoah
dunkiduk kungduruhruh
ulsoo

face off, just like john woo, ay
top star with that spotlight, ay
sometimes like a superhero
i'm your anpanman
24 hours isn’t enough
can’t afford to be confused
i do my thang (i do my thang)
i love myself (i love myself)

i love myself, i love my fans
love my dance and my what
there are hundreds of me’s inside of me
i’m facing a new me again today
it’s all me anyway
so instead of worrying, i’m just gonna run
runnin’ man
runnin’ man
runnin’ man

keep on chit-chatting, saying this and that
i do what i do, so you do you
you can’t stop me lovin’ myself

eolssu, i like it
you can’t stop me lovin’ myself
i like the shouts
you can’t stop me lovin’ myself

oh-oh-owoah
oh-oh-owoah-owoah
oh-oh-owoah
deonggideok kungdeoreoreo
eolssu
oh-oh-owoah
oh-oh-owoah-owoah
oh-oh-owoah
deonggideok kungdeoreoreo
eolssu

i’m so fine wherever i go
even if it takes a while sometimes
it’s okay, i’m in love with my-my myself
it’s okay, i’m happy in this moment

ulssu, i like it
you can’t stop me lovin’ myself
i like the shouts
you can’t stop me lovin’ myself

oh-oh-owoah
oh-oh-owoah-owoah
oh-oh-owoah
dunkiduk kungduruhruh
ulssu
oh-oh-owoah
oh-oh-owoah-owoah
oh-oh-owoah
dunkiduk kungduruhruh
ulssu",2018
Answer: Love Myself ,0.45,"i’m opening my eyes in the darkness
when my heartbeat sounds unfamiliar
i’m looking at you in the mirror
the fear-ridden eyes, asking the question

loving myself might be harder
than loving someone else
let’s admit it
the standards i made are more strict for myself
the thick tree rings in your life
it’s part of you, it’s you
now let’s forgive ourselves
our lives are long, trust yourself when in a maze
when winter passes, spring always comes

from the eyes of the cold night
i try to hide myself
as i keep tossing and turning ey
maybe i fell in order to take the place of those countless stars
the target of  thousands of bright arrows is me alone

you’ve shown me i have reasons
i should love myself (oh)
i’ll answer with my breath, my path

the me of yesterday, the me of today, the me of tomorrow
(i’m learning how to love myself)
with no exceptions, it’s all me

maybe there’s no answer
maybe this isn’t the answer either
it’s just that loving myself
doesn’t require anyone else’s permission
i’m looking for myself again
but i don’t wanna die anymore
me, who used to be sad
me, who used to be hurt
it’ll make me more beautiful

yes, i have that beauty
knowing that is going
on the path to loving myself
it’s what i need the most
i’m walking for myself
it’s an action needed for me
my attitude towards myself
that’s the happiness i need for me
i’ll show you what i got
i’m not afraid because it’s me
love myself

from the very beginning
to the very end
there’s only one answer ey
why do you keep trying to hide under your mask? (hey)
even all the scars from your mistakes make up your constellation (ey)

you’ve shown me i have reasons
i should love myself (oh)
i’ll answer with my breath, my path

inside of me
there’s still
that awkward part of me but (woah)

you’ve shown me i have reasons
i should love myself
(i’m learning how to love myself oh)
i’ll answer with my breath, my path

the me of yesterday, the me of today, the me of tomorrow (woah)
(i’m learning how to love myself)
with no exceptions, it’s all me",2018
Intro: Persona ,0.652,"who am i? the question i had my whole life
the question which i probably won’t find an answer to my whole life
if i were answerable with a few more words
then god wouldn’t have created all these various beauties
how you feel? how’re you feeling right now?
actually i’m real good but a little uncomfortable
i'm still not so sure if i'm a dog or a pig or what else
but then other people come out and put the pearl necklace on me
ptui!
i laugh more than i did before
i dreamt of becoming a superhero
now it feels like i really became one
but as it goes on there’s so much blabbering
one says, ""run"" another says, ""stop""
this one says, ""look at the forest"" that one says, ""look at the wild flower""
my shadow, i wrote and called it hesitation
it has never hesitated after becoming that
it keeps appearing under the stage or the light
keeps glaring at me scorchingly like a heat wave (oh shit)
hey, have you already forgotten why you even started this
you were just digging it that someone was listening
sometimes everything sounds like freakin' nonsense
you know what comes out of you when you're drunk.. like immaturity
someone like me ain't good enough for music
someone like me ain't good enough for the truth
someone like me ain't good enough for a calling
someone like me ain't good enough to be a muse
the flaws of mine that i know
maybe that's all i've got really
the world is actually not interested in my clumsiness at all
the regrets that i don't even get sick of anymore
i tumble with them every night until i'm disgusted
and twist the irreversible time habitually
there's something that raised me up again every time
the first question
the three syllables of my name and the word 'but' that should come before any of those
so i'm askin' once again yeah
who the hell am i?
tell me all your names baby
do you wanna die?
oh do you wanna go?
do you wanna fly?
where's your soul? where's your dream?
do you think you're alive?
i don't know man
but i know one thing
my name is r
the 'me' that i remember and people know
the 'me' that i created myself to vent out
yeah maybe i have been deceiving myself
maybe i've been lying
but i'm not embarrassed anymore this is the map of my soul
dear myself
you must never lose your temperature
cuz you don't need to be neither warm nor cold
though i might sometimes be hypocritical or pretend to be evil
this is the barometer of my direction i want to keep
the 'me' that i want myself to be
the 'me' that people want me to be
the 'me' that you love
and the 'me' that i create
the 'me' that's smiling
the me that's sometimes in tears
vividly breathing each second and every moment even now
persona
who the hell am i
i just wanna go
i just wanna fly
i just wanna give you all the voices till i die
i just wanna give you all the shoulders when you cry
persona
who the hell am i
i just wanna go
i just wanna fly
i just wanna give you all the voices till i die
i just wanna give you all the shoulders when you cry",2018
작은 것들을 위한 시 (Boy With Luv) ft. Halsey ,0.798,"(oh-oh-oh-oh-oh)
(oh-oh-oh-oh-oh)
(oh-oh-oh-oh-oh)
(oh-oh-oh-oh-oh)

i'm curious about you, how's your day?
oh, tell me (oh yeah oh yeah, ah yeah ah yeah)
what makes you happy?
oh, text me (oh yeah oh yeah, oh yeah oh yeah)

your every picture
i wanna have under my pillow, oh, oh bae
come be my teacher
teach me everything about you
your one, your two

listen my my baby
i'm flying high up in the sky
(with the two wings that you gave me back then)
now it's so high up here
i want you tuned in to my eyes
yeah, you makin' me a boy with luv

oh my, my, my, (uh) oh my, my, my
i've waited all my life
i want to be with you through everything
oh my, my, my, (yeah) oh my, my, my
looking for something right
okay, now, i kinda get it

(oh-oh-oh-oh-oh)
i want something stronger (i want it)
(oh-oh-oh-oh-oh)
than a moment, than a moment, love
(oh-oh-oh-oh-oh)
i have waited longer
(oh-oh-oh-oh-oh)
for a boy with, for a boy with luv

from the moment i met you, ya, my life was all you, ya
you’re the star that turns ordinaries into extraordinaries, oh yeah
one after another ay, ay, everything is special ay, ay
the things you’re interested in, the way you walk or talk, and every little trivial habit of yours

(hope world, ay)
everyone says that i used to be so little and now i became a hero (oh no)
i say that something like destiny was never my thing (oh no)
world peace (no way)
a great order (no way)
i just want to keep you safe
(boy with luv)

listen my my baby
i'm flying high up in the sky
(with the two wings that you gave me back then)
now, it's so high up here
i want you tuned in to my eyes
yeah, you makin' me a boy with luv

oh my, my, my, (uh) oh my, my, my
you got me high so fast
i want to be with you through everything
oh my, my, my, oh my, my, my
you got me fly so fast
okay, now, i kinda' get it

(oh-oh-oh-oh-oh)
love is nothing stronger (i want it)
(oh-oh-oh-oh-oh)
(than a boy with) than a boy with luv
(oh-oh-oh-oh-oh)
love is nothing stronger
(oh-oh-oh-oh-oh)
(than a boy with) than a boy with luv

i'll tell you frankly
sometimes i was a little stuck up
elevated sky, expanded halls
sometimes i prayed, let me run away
but your pain is my pain
when i realised that, i vowed to myself (yeah)
with the wings of icarus you gave me (uh)
not towards the sun but towards you
let me fly

oh my, my, my, (uh) oh my, my, my
i've waited all my life (all my life)
i want to be with you through everything
oh my, my, my, (yeah) oh my, my, my (oh, oh)
looking for something right (right)
okay, now, i kinda' get it

(oh-oh-oh-oh-oh)
i want something stronger (i want something stronger, i want it)
(oh-oh-oh-oh-oh)
than a moment, than a moment, love (mo-moment, love)
(oh-oh-oh-oh-oh)
love is nothing stronger (ooh ooh, oh yeah)
(oh-oh-oh-oh-oh)
(than a boy with) than a boy with luv",2019
소우주 (Mikrokosmos) ,0.475,"twinkling starlight
building with blinking light
we're shining brightly
in our own rooms, in our own stars

(ayo) one light is ambition
some light is rebellion
people's lights
all are precious
this dark night (don't be lonely)
like stars (we shine)
don't disappear
'cause you're a big existence
let us shine

perhaps the reason this night looks so beautiful (oh)
is not because of these stars or lights, but us

you got me
i dream while looking at you
i got you
inside those pitch black nights
the lights we saw in each other
were saying the same thing
starlight that shines brighter in the darkest night

starlight that shines brighter in the darkest night
the deeper the night, the brighter the starlight

one history in one person
one star in one person
7 billion different worlds
shining with 7 billion lights
7 billion lives, the city's night view
is possibly another city's night
our own dreams, let us shine
you shine brighter than anyone else
one

perhaps the reason this night looks so beautiful (oh)
is not because of these stars or lights, but us

you got me
i dream while looking at you
i got you
inside those pitch black nights
the lights we saw in each other
were saying the same thing
starlight that shines brighter in the darkest night

starlight that shines brighter in the darkest night
the deeper the night, the brighter the starlight

city lights, this city's star
i remember the night sky i saw when i was young
where people are light
where people are stars
in this place full of where
people are lights
we shinin'

you got me
i breathe while looking at you
i got you
inside those pitch black nights (shine)

shine, dream, smile (yeah, eh-eh-eh)
oh, let us light up the night
we shine in our own ways (our own ways)
shine, dream, smile
oh, let us light up the night
(oh, let us light up the night)
we shine just the way we are (we are)
tonight (tonight)
na-na-na-na-na-na
na-na-na-na-na-na-na-na
na-na-na-na-na-na
na-na-na-na-na-na-na-na
na-na-na-na-na-na
na-na-na-na-na-na-na-na
na-na-na-na-na-na
na-na-na-na-na-na-na-na",2019
Make It Right ,0.261,"the moment i noticed myself
i had to leave
i had to find out
all day all night

across the desert and the sea
this wide, wide world
i wandered
baby i

i could make it better
i could hold you tighter
on that long road
oh you're the light
uninvited
unwelcome
the only one who recognized me

this eternal night with no end in sight
it's you who gifted me the morning
can i now hold that hand?
oh oh
i can make it right

all right
all right
oh i can make it right

all right
all right
oh i can make it right

i became a hero in this world
the loud screams that seek me out
my hand, trophy and a gold microphone
all day, everywhere
but all of this is about reaching you
it's the answer to my journey
i'm singing to find you
baby to you

a little taller than i was before
with a voice a little more solid
all of this to go back to you
now i'll spread wide a map called you
my rehab
look at me, why can't you recognize me?
i don't want to hear other people's noises
your fragrance still penetrates and breaks me down
let's go back to that time

baby i know
i can make it better
i can hold you tighter
all those roads
are pointing to you

everything was useless
anything other than you
just touch me like that time

this eternal night with no end in sight
it's you who gifted me the morning
now can i hold that hand?
oh oh
i can make it right

all right
all right
oh i can make it right

all right
all right
oh i can make it right

you are still beautiful
just hold me silently like you did that day, that time
the reason i survived in hell
it's for you, it was not for me
if you know, don't hesitate and please save my life
i'm thirsty wandering this desert without you
so hurry and grab me quickly
i know the sea without you is the same as a desert

all right
i can make it better
i can hold you tighter
oh i can make it right

everything was useless
anything other than you
oh i can make it right",2019
HOME ,0.535,"i'm exhausted man
oh, guess what?
i just want to go home

in this excitement that's driving me crazy
i wasn't even able to greet you (yeah, right)
yeah i´m going out baby
the whole world is my home

crazy for myself (yeah)
like everything would work out when i opened that door (right)
like i was about to show something (uh huh)
i left home
(hoping all this imagination doesn't end as illusions)

oh yeah i did it, me shine with flashin' lights
got lotta friends, my quiet personal space
yeah, i remember when i thought i could do everything
i saw the ocean, yeah, before i opened this door
oh yeah

whatever i fill becomes emptier
the more we're together, i feel lonelier
half-closed eyes, sleepless light
the place where you are

that place is probably mi casa
with you i'mma feel rich (yeah)
that place is no other than mi casa
turn it on, your switch (switch)
yeah

it's comfortable even as you say nothing
with you, anywhere will be my home
you know i want that
home
you know you got that
home

your love your love your love (i miss that)
your love your love your love (i want that)
your touch your touch your touch (i need that)
la la la la la la la la la la i love it

my feet look strange in the entrance with lights off
i still feel strange as i close my eyes inside my blanket
i feel like i'm floating, both eyes spinning
in this fabulous space, i feel completely shabby

totally shabby
the world thinks we own the whole world
even if we have what i wanted in my dreams
big house, big cars, big rings
the unfamiliar feeling of missing something
for someone who has accomplished everything
but i go out the door since i know i have something to return to

i keep remembering you between crossroads
you knew me when i had nothing else
i could smile at the thought of you
the place where you are

that place is probably mi casa
with you i'mma feel rich (yeah)
that place is no other than mi casa
turn it on, your switch (switch)
yeah

it's comfortable even as you say nothing
if you are there, they'll all be my home
you know i want that
home
you know you got that
home

one day
will you open the door for me
when the doorbell rings three times
so that i could give the parting words
that i did not finish
i'll tell you then

it's been a while, mi casa
with you i just feel rich
i'm back, hi, mi casa
you left it on, your switch (switch)
yeah

it's comfortable even as you say nothing
it became my home because you were there
you know i want that
home
you know you got that
home

your love your love your love (i miss that)
your love your love your love (i want that)
your touch your touch your touch (i need that)
la la la la la la la la la la i love it",2019
Jamais Vu ,0.241,"i think i lost again
you look like you're mad
in a blur, game over over over

if this was a game
i could just load it again
i guess i gotta deal with this, deal with this
real world

it'd be better if it was a game
because it hurts so much
i need to heal my medic
but i'm another star
blame myself since i was imperfect
brake in my head, brake in my step, always
all i wanted was to do well
i wanted to make you smile, damn

please give me a remedy
a remedy to make my heart beat again
(remedy)
what should i do now
please save me, give me another chance
please give me

a remedy, a melody
a memory that will be left just for me
if i stop right now
if i just turn it off, will all be more comfortable?

i'm fine but i'm not fine
i told myself i was used to it
it always hurts like it's the first time

not a good gamer, that's right, you can't control me
it keeps hurting 'cause of trial and error and 50,000-something else
my song lyrics, each gesture
i become afraid of every word, my jamais vu
again, i try to escape as always
but still, you grab me
even as my shadow grows
my life and yours are an equal sign
so my remedy is your remedy

please give me a remedy
a remedy that will make my heart beat again
(remedy)
what should i do now
please save me, give me another chance
please give me a

(remedy)
run and run again, stumble again
(honestly)
even if it repeats forever
i'll keep running

so give me a remedy
a remedy that will make my heart beat again
(remedy)
what should i do now
please save me, give me another chance

please give me a remedy
(so is this success, i came back)
a remedy that will make my heart beat again
(i'll concentrate on reaching you no matter what, falling, stumbling)
what should i do now?
(this familiar pain seizes on me again)
save me
(it's not easy this time either)
please give me another chance
(am i giving up? no, no never)
i won't give up",2019
Dionysus ,0.588,"drink it up
shot glasses (sippin’) link arms (tippin’)
one shot
thyrsus (grippin’) grape (eatin’)
drink it up
vibes (keep it) d style (rip it)
one shot
here (kill it) let’s steal it
the illest

just get drunk like dionysus
drink in one hand, thyrsus on the other
art splashing inside this clear crystal cup
art is alcohol too, if you can drink it, you'll get drunk fool
you dunno you dunno
you dunno what to do with
i'll show you i recommend you something different
from my mic made of ivy and rough wood
there is never a sound that comes out in one breath

until the sun comes up, where the party at
until we fall asleep, where the party at
sing it, sing it again
drink it, drink it again
we’re born again

drink it up (the pain of creation)
one shot (the scolding of this era)
drink it up (talking with myself)
one shot (okay now l’m ready fo the sho)

drink, drink, drink, drink up my glass ay
everyone all, fall, fall into this crazy artist
one drink (one shot), two drinks (two shots)
get drunk on art and say onghaeya

drink, drink, drink, drink up my glass ay
everyone fall, fall, fall into this crazy artist
one drink (one shot), two drinks (two shots)
hit the gong and say onghaeya

shot glasses (sippin’), linked arms (tippin’)
thyrsus (grippin’), grape (eatin’)
vibes (keep it) d style (rip it)
here (kill it) let’s steal it
the illest

i'm now in front of the door to the world
the cheers i hear when i get up on stage
can’t you see my stacked
broken thyrsus
at last i’m reborn

when the night comes
mumble mumble mumble
when the night comes
tumble tumble tumble
the bass, bass, bass filling the studio
bass drum goes like dum dum dum (yeah)

until the sun comes up, where the party at
until we fall asleep, where the party at
sing it, sing it again
drink it, drink it again
and we’re born again

drink it up (the pain of creation)
have a mouthful (the scolding of this era)
drink it up (talking with myself)
one shot (okay now l’m ready fo the sho)

drink, drink, drink, drink up my glass ay
everyone fall, fall, fall into this crazy artist
one drink (one shot), two drinks (two shots)
get drunk on art and say onghaeya

drink, drink, drink, drink up my glass ay
everyone fall, fall, fall into this crazy artist
one drink (one shot), two drinks (two shots)
hit the gong and call onghaeya

if we pop up
anywhere in the world, stadium party ay
born as a k-pop idol
reborn as an artist
reborn as an artist, reborn as an artist
what does it matter if i’m an idol or an artist, cheers
art at this level is over-drinking, over-drinking yeah
the new record is the fight against oneself, a fight yeah
toast to this, one shot
but i‘m still thirsty
what

you ready for this?
are you ready to get hyped up?
come on

drink, drink, drink, drink up my glass ay
everyone fall, fall, fall into this crazy artist
one drink (one shot), two drinks (two shots)
get drunk on art and say onghaeya

drink, drink, drink, drink up my glass ay
everyone fallin', fallin', fallin' into this crazy artist
one drink (one shot), two drinks (two shots)
hit the gong and call onghaeya

shot glasses (sippin’) linked arms (tippin’)
thyrsus (grippin’) grape (eatin’)
vibes (keep it) d style (rip it)
here (kill it), let’s steal it
the illest

shot glasses (sippin’) linked arms (tippin’)
thyrsus (grippin’) grape (eatin’)
vibes (keep it) d style (rip it)
here (kill it) let’s steal it
the illest",2019
