track_title,valence,lyrics,album_yr
BTS Cypher PT. 2 : Triptych,0.837,"because of who? because of j-hope
because of who? because of rap mon
again, because of who? because of suga
all of the style and flow is because of bangtan

the kids who will lead the 21st century hallyu has started to play
we're seven wolves, gathering the lambs with a trap
we pull through all the broken rap from now on
we keep driving forward, giants on the beats
bangtan cypher right here, psycho right here
whoever's in the ring, we'll win, rap fighter right here
i'll say hi, you'll say bye, a burnt tire, we're different
fire, hot choir, captivating k-pop like psy
my rap is huge, i'll say right in your ear, bug that
our riots got successively stronger
don't need long explanations, just explain with a rap
bts, follow the leader, let's go now
what

i'm a rap wiper, a complete psycho, if i'm a dicer, then i have all the dice
cypher, if you're nice, i'm nicer
if you're pride, then i'm a chrysler, that means i'mma priceless
who are you to judge my rap? rapper?
this is one piece, i'm a whitebeard, you just have long beards like catfish, bucket
hehe haha, honk honk, 300 per hour
i'm going through the process of working hard
i won't discriminate but catch them all, tombstone, knock knock knock out
fire in the hole beat bing bing pow pow, you'll cry and look for your dad
my voice constricts the voices of the plain rappers at all times, like the pc cafe closing
this is a kingdom, i'm a king, you're dumb
i'm chew you and swallow, you're bubblegum
on top of the running man is the flying man
on top of the flying man is the one who rides on him
that's me, beat, a badder guy than rain
like rags, i just hang it up, after i play with it, i rip up your eardrums, boom boom boom
this is the curse of my dawn, a nightmare, a riot, serial murder, theft, doom doom doom
you're like a kakaotalk with no friends, no reason to look
did you already wet your pants? sorry, there's no bathroom
i'm commanding you, let go of the mic and get up
just do the ""chun"" because you have no ""shil""
i'll push you out because i really don't like you
i'm good at sewing, putting it into practice
i'm growling right now, you're in a bit of danger
just do the ""yeon,"" like i said, you have no ""shil""
rise and rise to the sky but get ripped, bucket, i've forgotten you
my voice, my hegemony, i made it from one to ten
i put the whole world on my tongue
i play with big boys, i ain't spittin low sh
on the cd or the tv, you can see me, envy me, it's a pity, gee gee
beat i'mma monster i rap with a prospect, yeah i rap with a mindset i'm a suspect
sucka where yo rhymes at where you lines at? i'm da king, i'm the god so where ma emperors at?
i parachute on my neverland, i'mma peter pan, so this will never end
you know when i ride on my g5 you sit first class and satisfy and i keep giggling
keep gigglin, keep jigglin, bring yo booking mic beat, wanna have a go?
hyungs who are sick with pride and strange beliefs get lost after 8 measures
you old catepillars, i'll give you this beat, give it a try
hey, start talking when you can start rapping
there should be a law restricting you from rapping

because of who? because of j-hope
because of who? because of rap mon
again, because of who? because of suga
us three gather together and shout out a new generation
because of j-hope
because of who? because of j-hope
because of who? because of rap mon
again, because of who? because of suga
the next batter will rap on top of this beat

speech and action are like shackles, my crime is assault with my tongue
you're so bad ever since you were born
if you're gonna whine about this beat, just leave
look at the arrogance of the hip-hop con artists
when you were playing underground, bts was playing at ground level
compared to you who sleeps all night, i'm a workaholic, shoppaholic
overspending on my pens that are more in number than your fans, if i go all in and shoot, it's a goal in
goal in, i'm ballin, when i hear your rap, i'm about to throw up
my voice even bewitches your girlfriend
the studio is my playground, my partner is a pen and paper
you think being escorted makes you powerful, i hope you put down your mic
if i'm the sun, you're the moon, because when i rise, you go down
all you hip-hip designer brand bastards, come down from the foamy bubbles
hey you brats, your crappy rap is a burden to others
take a break and wait, just go to hawaii, go home
see how far i go, all the rotten roots will be replaced
everyone, let's play a game, without efforts, you'll just be grieving
you think you can do music? just go look for a part-time job
although your short and thin career will get you nowhere
i hope you survive, keep rotting away, that's your label
your life is like a mudfish, your rap is recycled
you save up and divide up the flow, write it up and use it again
hey beat, know that you're embarrassing, just with 24 measures, you lay down sick
compared to your size, your rap is so thin
like your parents, my heart hurts every time i see you
i'll put a period at the artery of your music career",2014
등골브레이커 (Spine Breaker) ,0.862,"(la la la la la la la la la)
yeah yeah yeah yeah yeah yeah
(la la la la la la la la la)
yeah yeah yeah yeah yeah yeah
(la la la la la la la la la)
you know bts is back!

with shoes worth a couple hundred, padded jacket worth a couple thousand
with a watch worth a couple hundred you feel good about yourself
education goes over the hill and student identity goes over the hill too
the class system of the 21st century is divided into two
those who have and those who haven’t
those who wear the shoes and those who don’t
those who have the clothes and those who don’t
and those who try hard to get those things
what’s going on? are you falling behind on the trend?
you whined and complained to get it, did i strike a nerve?
in your padded jacket, your greed fills it up
even after seeing your parents’ curved spines, you’re so coldhearted
you complain that all your friends have it and that they should buy it for you
(ayo baby) stop being so immature
you won’t freeze just because you don’t have that jacket
fill your head with good sense before it’s too late

wow, it feels good, putting on your dirty clothes
you’re something different, rockin, rollin, swaggin, swagger, wrong!
what is wrong with you? you’re crazy baby
that is what will suffocate your heart, dirty clothes

(la la la la la la la la la)
you are a spine breaker
(la la la la la la la la la)
your parent’s spine breaker
(la la la la la la la la la)
some day, you’ll regret it
(la la la la la la la la la)
those damn spine breakers

what’s up, kid? you don’t know how good you have it these days
maybe i’m crossing the line for butting in other people’s lives
why do you keep saying those empty words?
i’m saying i’ll spend my own money that i received
you’ll only be satisfied if i spend my money like you spend yours
please go take care of yourself
it’s about your life, if you were me, i wouldn’t say anything
yeah, my jacket is really expensive and not pretty at all
(but i say) i really want it so what do i do?
friends who are poorer than me have it too
(and i say) i have no choice but to buy it if i don’t wanna be an outcast
people my age are all like this
yeah i dunno, yes i’m loco, is it no-no?
i know they ain’t cheap but they got mojos
but i do what i gotta do, i don’t break my parent’s spines
the true breaker is you, who is old and stuck in your room

wow, it feels good, putting on your dirty clothes
you’re something different, rockin, rollin, swaggin, swagger, wrong
what is wrong with you? you’re crazy baby
that is what will suffocate your heart, dirty clothes

dirty clothes for you, dirty clothes for me
everyone experienced it before
wearing expensive clothes and walking on the street, feeling good about yourself
everyone looks smaller than me like i’m gulliver
whatever you wear, i understand but you’re too much
you’re gonna regret it
you can keep your swag on but how about your parents?
fine, i won’t stop you but make a decision now

wow, it feels good, putting on your dirty clothes
you’re something different, rockin, rollin, swaggin, swagger, wrong!
what is wrong with you? you’re crazy baby
that is what will suffocate your heart, dirty clothes

(la la la la la la la la la)
you are a spine breaker
(la la la la la la la la la)
your parent’s spine breaker
(la la la la la la la la la)
some day, you’ll regret it
(la la la la la la la la la)
those damn spine breakers",2014
JUMP ,0.763,"(let’s jump!) throw your hands up and scream together, pump it up
(let’s jump!) throw your hands up and scream together, jumpin up
(let’s jump!) let’s jump
(let’s jump!) pay attention
(let’s jump!) put your hands to the sky and scream together, jumpin up

everybody say
(let’s jump!) all the dreamers
(let’s jump!) put your hands up
(let’s jump!) throw your worries away
let’s jump! jump! ju-ju-ju-jump!
(let’s jump!) all the dreamers
(let’s jump!) put your hands up
(let’s jump!) throw your worries away
let’s jump! jump! ju-ju-ju-jump!

the hero you’ve dreamed of since you were young
we used to jump, wanting to be heroes
but now we’ve grown and time has passed
you’re becoming an adult but i wanna rewind
to the times when the 10-year-old boy sang the theme song to his favorite superhero comic
i wanna go back so i close my eyes and scream
but nothing changes, reality is the same
no matter who tries to stop me
i will go on my way
you only live once
leggo (leggo!)
leggo (leggo!)
even if i live for a day
i’ll have no regrets
let’s jump
let’s jump! (jump! jump! jump! jump!)

(let’s jump!) throw your hands up and scream together, pump it up
(let’s jump!) throw your hands up and scream together, jumpin up
(let’s jump!) let’s jump
(let’s jump!) pay attention
(let’s jump!) put your hands to the sky and scream together, jumpin up

everybody say
(let’s jump!) all the dreamers
(let’s jump!) put your hands up
(let’s jump!) throw your worries away
let’s jump! jump! ju-ju-ju-jump!
(let’s jump!) all the dreamers
(let’s jump!) put your hands up
(let’s jump!) throw your worries away
let’s jump! jump! ju-ju-ju-jump!

2007 is when my life changed
it’s been 7 years since i’ve sang
a killer of girls’ hearts
but sometimes, i go back to those frustrating times
facing myself, who was like a white piece of paper
that encounter awakens a different me
now i’ll go up on stage
and surprise everyone by jumping like jordan
ball!
go back a few years
taking out the trampoline from the corner of the room and jump around in the air
you used to feel the joy of each jump, feeling like you have everything
letting myself go to the innocent dreams
my childhood days was impatient to be an adult
but each day was filled with joy
so can i be the one, just can i be the one
that i... stop

(let’s jump!) throw your hands up and scream together, pump it up
(let’s jump!) throw your hands up and scream together, jumpin up
(let’s jump!) let’s jump
(let’s jump!) pay attention
(let’s jump!) put your hands to the sky and scream together, jumpin up

let’s jump & down, we are here, we are bts
beat down, if you’re ready, put your hands up high
it’s different from what you’ve dreamed of when you were little but we have met, we’re heroes, rappers in training
now jump to the stage, we are the new generation heroes
seven heroes-in-training, who were once immature, making a jump sound
instead of a trampoline, the place i need to jump on is the stage, crazily, up down
now don’t just talk about it, it’s time to spread my wings and go, let’s get it started
spread your shoulders, rock your body, empty your head, let’s go party

(let’s jump!) all the dreamers
(let’s jump!) put your hands up
(let’s jump!) throw your worries away
(let’s jump!) all the dreamers
(let’s jump!) put your hands up
(let’s jump!) throw your worries away
(let’s jump!) all the dreamers
(let’s jump!) put your hands up
(let’s jump!) throw your worries away",2014
Outro: Propose ,0.514,"i give it to you
although it was a bit awkward, i want to give it all to you
i give it to you
to me, who sometimes cries and laughs, it’s only you
for you

the moment i first saw you
with short hair and a pretty school uniform
i only remember that image
you can’t go anywhere
you have to only look at me too
i don’t know why my heart is like this
i only think of you always
i’ll become a rhythm and a song
and sing it for you

(good to you)
i only have you
(good to you)
even if i’m far away
always stay by my side
(good to you)
you’re my everything
even if the difficult tomorrow comes
hold my hand

i give it to you
although it was a bit awkward, i want to give it all to you
i give it to you
to me, who sometimes cries and laughs, it’s only you
for you
(good to you)
(good to you)
good to you",2014
Miss Right ,0.855,"you're my miss right, miss right
if i lose you, it’s a miss, right? miss right? (all right)
you're my miss right, miss right
girl you want my kiss, right? miss right (all right)

your sexy mind and your sexy body
you were even born with sexy brain wrinkles
just in jeans, a white tee and converse high tops
that makes me wanna party on your body
at the end of of your long, shiny hair
your gentle hips sing
you’re like a forest, shining inside the city
with that unrealistic body, you embrace my reality
and i want you to be really really real for me
sometimes like my mom, sometimes you’re my energy
i’m an honest guy
i’m so nice on the outside that my enemies can’t stop being honest
you’re so different from the normal people outside
that’s why you’re called the ideal type
yeah, when i think of you, my heart grows cold
you’re my winter ocean, i want to walk by you

yes you’re my only girl, you’re the best
i want to know about your day, i want to become your sighs
yes you’re my only girl, you’re the best
you’re someone who only exists in the movies

even the weather is good, i think i’m perfect with you
wanna walk together? wanna walk together?
even the weather is good, i think i’m perfect with you
you’re someone who only exists in novels
it’s you

how can a person be like this?
i start to feel like i’m the only one living in this world
you pass by my side
a sweet wind called you is blowing in my heart
even if you don’t put on makeup
you’ll put on your perfume called attraction
i never believed that there was a god
but now you make me believe because to me, you’re a goddess
whether you’re young or old, whether you have a hidden child
i don’t care because i love you
if i’m with you, anywhere we go is a flower garden
instead of holding designer bags, you hold my hand
instead of jealousy and envy, you understand my nature
with you, i draw out my future
in between our couple shoes are a pair of baby sneakers

yes you’re my only girl, you’re the best
i want to know about your day, i want to become your sighs
yes you’re my only girl, you’re the best
you’re someone who only exists in the movies
it’s you

i think she has come, i’m in front of the person who shakes up my heart
i think i’m attracted to you like a magnet, right now
your life, your heart, your face, your line
like a piece of a puzzle, you fit into my ideal type
oh god, i’m like the wind that is led by the weather that is you
you’re a flower, i’m a bee, i’m only going toward you
yo
i told you many qualifications ’bout my miss right
but why you’re my miss right is... you are...
just you

yes you’re my only girl, you’re the best
i want to know about your day, i want to become your sighs
yes you’re my only girl, you’re the best
you’re someone who only exists in the movies

even the weather is good, i think i’m perfect with you
wanna walk together? wanna walk together?
even the weather is good, i think i’m perfect with you
you’re someone who only exists in novels
it’s you",2014
Intro: 화양연화 (The Most Beautiful Moment In Life) ,0.257,"the rim looks farther away today
sighs are building on top of the court
the boy is afraid of reality
but his heart is at peace only when he throws the ball
throwing the ball by himself
what i’m shooting at the rim
are my countless thoughts and worries
i pretend to know the world but my body is still not ready
shoot, the court is my playground
with my movements, a small ball bounces next to my feet
the results are as low as the floor
but i just shout out loud to the world that everything’s gonna be alright
but the world gives me fear, then just stop
thoughts fill my head and instead of the ball, i throw my future
because of the other’s standard of success
my worries spread like cancer again, god damn it
along with the thrown ball, laughter starts to spread
my breath rises to my chin, my dreams squirm about
the dribbles get faster, my heart gets happier
this moment feels like it’ll last forever but the sun is setting
when the night comes again, reality gets destroyed
when i snap out of it, i’m just a scared idiot again
i keep getting scared at the looming sense of reality
others are running ahead but why am i still here?
breathe or dream
row the oars along with your heartbeat
if you are trapped in the other’s thin judgements
then the sun will set on your life like a court
what am i doin’ with my life
this moment won’t ever come again
i’m asking myself again, am i happy right now?
the answer is already there, i’m happy",2015
I NEED U ,0.71,"fall fall fall, scattering apart
fall fall fall, falling

because of you, i’m becoming ruined
i wanna stop, i don’t want you anymore
i can’t do it, this sucks
please don’t give me any excuses

you can’t do this to me
all of the things you said are like a mask
it hides the truth and rips me apart
it pierces me, i’m going crazy, i hate this
take it all away, i hate you

but you’re my everything (you’re my)
everything (you’re my)
everything (you’re my)
please go away huh
i’m sorry (i hate you)
i love you (i hate you)
forgive me

i need you girl
why am i in love alone, why am i hurting alone
i need you girl
why do i keep needing you when i know i’ll get hurt?
i need you girl, you’re beautiful
i need you girl, you’re so cold
i need you girl i need you girl
i need you girl i need you girl

it goes round & round, why do i keep coming back
i go down & down, at this point, i’m just a fool
whatever i do, i can’t help it
it’s definitely my heart, my feelings but why don’t they listen to me
i’m just talking to myself again, talking to myself again
i’m just talking to myself again, talking to myself again
you’re not saying anything, please, i’ll treat you well
but the sky is blue, the sky is blue

the sky is blue and the sun is shining
so my tears are even more noticeable
why is it you? why did it have to be you?
why can’t i leave you?

i need you girl
why am i in love alone, why am i hurting alone
i need you girl
why do i keep needing you when i know i’ll get hurt?
i need you girl, you’re beautiful
i need you girl, you’re so cold
i need you girl i need you girl
i need you girl i need you girl

girl, just tell me you wanna break up
girl, just tell me it wasn’t love
i have no courage to say that
give me my last gift
so i can’t ever go back to you

i need you girl
why am i in love alone, why am i hurting alone
i need you girl
why do i keep needing you when i know i’ll get hurt?
i need you girl, you’re beautiful
i need you girl, you’re so cold
i need you girl i need you girl
i need you girl i need you girl",2015
잡아줘 (Hold Me Tight),0.395,"i empty my drink but it gets filled with loneliness
i should’ve just given in, why did i argue all the time?
even the trash bag thrown away on the street makes a lonely sound in the wind
all i did was color you in my white, blank paper
but then i realized, it already became a finished picture
you and i are like cell phones, when we’re apart you know we’ll be broken
only your scent completes me
hurry and hug me

i can only see you
i can only see you alone
look, i’m fair with everyone else but you
now i can’t live a day without you, please

hold me tight, hug me
can you trust me? can you trust me? can you trust me?
pull me in tight
hold me tight, hug me
can you trust me? can you trust me?
please, please, please pull me in and hug me

you still shine
you’re still like a scented flower
now trust me, hold me once again
so i can feel you, hold me
without you, i can’t breathe
i’m nothing without you
open my closed heart, drench my heart
so i can feel you, hold me

your arms, your warmth, your heart
i want to see it all, i beg you
this moment, even the warm flower scented wind
even the sky without a single cloud
everything feels cold and i’m even scared of the clear sky
if you’re not here, i’m just a corpse, so how can i breathe?
it hurts, i’m always cry cry cry
i’m going crazy, exhausted without you
i think of you without stopping
i hate it all, i hate every single day
it makes me cry, ring ding dong
if there’s a chance, i’ll catch you
i’m running, it’s starting, count down
i’m ready to be cut by your rose-like embrace, as i hold you again

i can only see you
i can only see you alone
look, i’m fair with everyone else but you
now i can’t live a day without you, please

hold me tight, hug me
can you trust me? can you trust me? can you trust me?
pull me in tight
hold me tight, hug me
can you trust me? can you trust me?
please, please, please pull me in and hug me

your cold face tells me everything rather than words
i can see a break up rising over me like a high tide
i know it will soon be our last but i can’t let you go
don’t talk, don’t leave, just quietly hold me girl

hold me tight, hug me
trust me, trust me, trust me
hold me tight, hug me
can you trust me? can you trust me?
please, please, please pull me in and hug me

you still shine
you’re still like a scented flower
now trust me, hold me once again
so i can feel you, hold me",2015
쩔어 (DOPE) ,0.622,"welcome, it's your first time with bts, isn't it?

ayo ladies & gentleman
if you’re ready, i’ll start, yeah
i am different from the other guys
with my style, with my, my, my, my style

i worked all night, everyday
while you were out clubbing
don’t be surprised, listen every day
i got a feel, i got a feel

i’m kinda dope

we're drenched, drenched, drenched
in sweat, in our practice room
look, my great, great, great
dance moves prove it all
all the weak, loser, whiny idiots
they have nothing on me
cuz i'm full of hope haha

ok we're dope from head to toe
over half of the day, we drown in work
even if our youth rots in the studio
thanks to that, we're closer to success
girls, shout louder
make it ring, ring

i worked all night, every day
while you were playing in the club
i am different from other guys
i don’t wanna say yes
i don’t wanna say yes

make some noise, all right
till your body burns up, all night (all night)
cause we got fire (fire!)
higher (higher!)
i gotta make it, i gotta make it
it’s dope

i reject rejection
i'm always over the top
dope, dope, dope, dope
i reject rejection
you all work for me
dope, dope, dope

given up on 3? given up on 5??
i like the number 6, how about giving up on 6?
the media and adults say we don’t have willpower, condemning us like stocks
why are they killing us before we can even try, enemy enemy enemy
why are you hanging your head and accepting it already? energy energy energy
don’t ever give up, you know you not lonely
our dawn is prettier than the day
so can i get a little bit of hope yeah
wake your sleeping youth, go

i worked all night, every day
while you were playing in the club
i am differently from other guys
i don’t wanna say yes
i don’t wanna say yes

make some noise, all right
till your body burns up, all night, all night
cause we got fire fire
higher higher
i gotta make it, i gotta make it
it’s dope

i reject rejection
i was always too much
it’s dope
reject rejection
you're all my slaves
everyone follow me
it’s dope

this  is bts style
different from those lying wack jobs
every day is hustle life
i gotta make it fire baby
this is bts style
different from those lying wack jobs
every day is hustle life
i gotta make it
i gotta make it
i’m kinda awesome

say what!
say wo~ wo~
say what!
dope dope dope",2015
